{
  "format": "pipwerk.rule",
  "format_version": "2.0",
  "id": "5b0f8e1c-2d47-4c3a-9a61-7e24d9c0b3f8",
  "name": "Mindestvolumen doppelt",
  "description": "Geänderte Fassung: Das Volumen einer Order erreicht das Doppelte des Mindestvolumens.",
  "object_type": "Regel",
  "parameter_values": {},
  "parameters": [],
  "properties": [],
  "instances": [],
  "rules": [],
  "expression": "Order.volumen >= 2 * Order.instrument.mindestvolumen",
  "determined_property": null,
  "comparison": null,
  "result_expression": null
}
